-- Create table and disable autovacuum
CREATE TABLE foo (bar bigint, baz text);
ALTER TABLE foo SET (
  autovacuum_enabled = false, toast.autovacuum_enabled = false
);
-- single row
INSERT INTO foo VALUES (1, 'Hello world');
SELECT * FROM pg_dirtyread('foo'::regclass) as t(bar bigint, baz text);
 bar |     baz     
-----+-------------
   1 | Hello world
(1 row)

DELETE FROM foo;
SELECT * FROM pg_dirtyread('foo'::regclass) as t(bar bigint, baz text);
 bar |     baz     
-----+-------------
   1 | Hello world
(1 row)

VACUUM foo;
-- multiple rows
INSERT INTO foo VALUES (1, 'Delete'), (2, 'Insert'), (3, 'Update');
DELETE FROM foo WHERE bar = 1;
UPDATE foo SET baz = 'Updated' WHERE bar = 3;
SELECT * FROM pg_dirtyread('foo'::regclass) as t(bar bigint, baz text);
 bar |   baz   
-----+---------
   1 | Delete
   2 | Insert
   3 | Update
   3 | Updated
(4 rows)

-- error cases
SELECT * FROM pg_dirtyread(0) as t(bar bigint, baz text);
ERROR:  invalid relation oid "0"
SELECT * FROM pg_dirtyread('foo'::regclass) as t(bar int, baz text);
ERROR:  Error converting tuple descriptors!
DETAIL:  Returned type bigint does not match expected type integer in column 1.
SELECT * FROM pg_dirtyread('foo'::regclass) as t(bar bigint);
ERROR:  Error converting tuple descriptors!
DETAIL:  Number of returned columns (2) does not match expected column count (1).
